{
  "id": "teclast-f7-plus-3-windows-10-v5",
  "metadata": {
    "make": "Teclast",
    "model": "F7 Plus 3",
    "year": 2021,
    "os_target": "Windows 10",
    "form_factor": "Laptop"
  },
  "hardware": {
    "cpu_cores": 4,
    "cpu_name": "Intel Celeron N4120",
    "ram_mb": 8192,
    "storage_gb": 256,
    "gpu_name": "Intel UHD Graphics 600",
    "gpu_vram_mb": 0,
    "screen_resolution": "1920x1080"
  },
  "environment": {
    "accessibility_mode": "High Contrast",
    "boot_mode": "Normal"
  },
  "software": {
    "primary_browser": "Firefox"
  }
}