{
  "id": "system76-thelio-windows-11-v1233",
  "metadata": {
    "make": "System76",
    "model": "Thelio",
    "year": 2021,
    "os_target": "Windows 11",
    "form_factor": "Desktop"
  },
  "hardware": {
    "cpu_cores": 6,
    "cpu_name": "AMD Ryzen 5 5600X",
    "ram_mb": 16384,
    "storage_gb": 2048,
    "gpu_name": "AMD Radeon RX 6600 XT",
    "gpu_vram_mb": 8192,
    "screen_resolution": "2560x1440"
  },
  "environment": {
    "accessibility_mode": "Standard",
    "boot_mode": "Normal"
  },
  "software": {
    "primary_browser": "Edge"
  }
}