{
  "id": "lenovo-thinkpad-t480-windows-11-v233",
  "metadata": {
    "make": "Lenovo",
    "model": "ThinkPad T480",
    "year": 2018,
    "os_target": "Windows 11",
    "form_factor": "Laptop"
  },
  "hardware": {
    "cpu_cores": 4,
    "cpu_name": "Intel Core i5-8250U",
    "ram_mb": 8192,
    "storage_gb": 512,
    "gpu_name": "Intel UHD Graphics 620",
    "gpu_vram_mb": 1024,
    "screen_resolution": "1920x1080"
  },
  "environment": {
    "accessibility_mode": "High Contrast",
    "boot_mode": "Normal"
  },
  "software": {
    "primary_browser": "Firefox"
  }
}