{
  "id": "msi-gs66-stealth-windows-11-v838",
  "metadata": {
    "make": "MSI",
    "model": "GS66 Stealth",
    "year": 2020,
    "os_target": "Windows 11",
    "form_factor": "Laptop"
  },
  "hardware": {
    "cpu_cores": 8,
    "cpu_name": "Intel Core i9-11900H",
    "ram_mb": 65536,
    "storage_gb": 2048,
    "gpu_name": "NVIDIA GeForce RTX 2070 Super",
    "gpu_vram_mb": 8192,
    "screen_resolution": "2560x1440"
  },
  "environment": {
    "accessibility_mode": "High Contrast",
    "boot_mode": "Normal"
  },
  "software": {
    "primary_browser": "Chrome"
  }
}