{
  "id": "framework-laptop-13-(intel-13th-gen)-windows-11-v219",
  "metadata": {
    "make": "Framework",
    "model": "Laptop 13 (Intel 13th Gen)",
    "year": 2023,
    "os_target": "Windows 11",
    "form_factor": "Laptop"
  },
  "hardware": {
    "cpu_cores": 12,
    "cpu_name": "Intel Core i7-1360P",
    "ram_mb": 65536,
    "storage_gb": 512,
    "gpu_name": "Intel Iris Xe",
    "gpu_vram_mb": 0,
    "screen_resolution": "2256x1504"
  },
  "environment": {
    "accessibility_mode": "Standard",
    "boot_mode": "Normal"
  },
  "software": {
    "primary_browser": "Edge"
  }
}