{
  "id": "acer-swift-3-windows-11-v182",
  "metadata": {
    "make": "Acer",
    "model": "Swift 3",
    "year": 2020,
    "os_target": "Windows 11",
    "form_factor": "Laptop"
  },
  "hardware": {
    "cpu_cores": 6,
    "cpu_name": "AMD Ryzen 5 5500U",
    "ram_mb": 16384,
    "storage_gb": 512,
    "gpu_name": "AMD Radeon Graphics",
    "gpu_vram_mb": 512,
    "screen_resolution": "1920x1080"
  },
  "environment": {
    "accessibility_mode": "Standard",
    "boot_mode": "Normal"
  },
  "software": {
    "primary_browser": "Firefox"
  }
}