{
  "id": "dynabook-port\u00e9g\u00e9-x30l-k-windows-10-v39",
  "metadata": {
    "make": "Dynabook",
    "model": "Port\u00e9g\u00e9 X30L-K",
    "year": 2022,
    "os_target": "Windows 10",
    "form_factor": "Laptop"
  },
  "hardware": {
    "cpu_cores": 12,
    "cpu_name": "Intel Core i5-1240P",
    "ram_mb": 16384,
    "storage_gb": 256,
    "gpu_name": "Intel Iris Xe",
    "gpu_vram_mb": 0,
    "screen_resolution": "1366x768"
  },
  "environment": {
    "accessibility_mode": "Standard",
    "boot_mode": "Normal"
  },
  "software": {
    "primary_browser": "Edge"
  }
}