{
  "id": "infinix-inbook-x1-windows-10-v3",
  "metadata": {
    "make": "Infinix",
    "model": "INBook X1",
    "year": 2021,
    "os_target": "Windows 10",
    "form_factor": "Laptop"
  },
  "hardware": {
    "cpu_cores": 2,
    "cpu_name": "Intel Core i3-1005G1",
    "ram_mb": 8192,
    "storage_gb": 256,
    "gpu_name": "Intel UHD Graphics",
    "gpu_vram_mb": 0,
    "screen_resolution": "1920x1080"
  },
  "environment": {
    "accessibility_mode": "Standard",
    "boot_mode": "Normal"
  },
  "software": {
    "primary_browser": "Edge"
  }
}