{
  "id": "hp-compaq-dc7800-windows-7-v700",
  "metadata": {
    "make": "HP",
    "model": "Compaq dc7800",
    "year": 2007,
    "os_target": "Windows 7",
    "form_factor": "Desktop"
  },
  "hardware": {
    "cpu_cores": 2,
    "cpu_name": "Intel Core 2 Duo E6550",
    "ram_mb": 8192,
    "storage_gb": 250,
    "gpu_name": "Intel GMA 3100",
    "gpu_vram_mb": 256,
    "screen_resolution": "1280x1024"
  },
  "environment": {
    "accessibility_mode": "Standard",
    "boot_mode": "Normal"
  },
  "software": {
    "primary_browser": "Internet Explorer"
  }
}