{
  "id": "tuxedo-infinitybook-pro-14-windows-11-v109",
  "metadata": {
    "make": "Tuxedo",
    "model": "InfinityBook Pro 14",
    "year": 2023,
    "os_target": "Windows 11",
    "form_factor": "Laptop"
  },
  "hardware": {
    "cpu_cores": 14,
    "cpu_name": "Intel Core i7-12700H",
    "ram_mb": 65536,
    "storage_gb": 500,
    "gpu_name": "Intel Iris Xe",
    "gpu_vram_mb": 0,
    "screen_resolution": "2880x1800"
  },
  "environment": {
    "accessibility_mode": "Standard",
    "boot_mode": "Normal"
  },
  "software": {
    "primary_browser": "Chrome"
  }
}