{
  "id": "zebra-l10-rugged-tablet-windows-10-v56",
  "metadata": {
    "make": "Zebra",
    "model": "L10 Rugged Tablet",
    "year": 2020,
    "os_target": "Windows 10",
    "form_factor": "Tablet"
  },
  "hardware": {
    "cpu_cores": 4,
    "cpu_name": "Intel Pentium N4200",
    "ram_mb": 4096,
    "storage_gb": 128,
    "gpu_name": "Intel UHD Graphics 620",
    "gpu_vram_mb": 0,
    "screen_resolution": "1920x1200"
  },
  "environment": {
    "accessibility_mode": "Standard",
    "boot_mode": "Normal"
  },
  "software": {
    "primary_browser": "Firefox"
  }
}